100;Сейчас принято украшать ель самыми разными игрушками, но так было не всегда. Чем украшали ёлку в XVIII-XIX веках?;Яблоками, конфетами и другими сладостями
200;Сейчас украшение елки – досуг для всей семьи, но раньше не все члены семьи могли этим заниматься. Кому можно было украшать ёлку?;Только взрослым
300;Почему в царской России ёлки по-началу продавались в кондитерских?;Хз
400;Сейчас символом Нового года является мандарин, но так было не всегда. Какой фрукт считался новогодним в 18-19 веках?;Хз
500;В наше время в одной квартире зачастую стоит одна ёлка, но при императоре было иначе. Сколько ёлок стояло в Зимнем дворце, если это связано с размером императорской семьи?;По ёлке на ребёнка императора
600;При Петре Великом двери трактиров стали украшать еловыми ветками, и, в связи с этим, появилось выражение «Елки-палки». Предположите, почему эти два факта связаны?;Ёлки у трактиров оставались на улицу долгое вмемя, пока вся хвоя не осыпалась, служа своеобразным ориентиром. Вход в трактир можно было найти у ёлок палок.